Название,Цена,Ссылка
Диван прямой Нумо Velvet Pink,38 990руб.,https://www.divan.ru/product/divan-numo-velvet-pink
Банкетка Вайли Velvet Light,10 990руб.,https://www.divan.ru/product/banketka-vajli-velvet-light
Диван прямой Риен Velvet Stone,58 990руб.,https://www.divan.ru/product/divan-rien-velvet-stone
Кресло Кото Cozy Beige,32 990руб.,https://www.divan.ru/product/kreslo-koto-cozy-beige
Диван прямой Нумо Мини Textile Yellow,26 990руб.,https://www.divan.ru/product/divan-numo-mini-textile-yellow
Диван угловой Онте Bucle Silver,109 990руб.,https://www.divan.ru/product/divan-uglovoj-onte-bucle-silver
Кресло Витио Velvet Yellow,22 990руб.,https://www.divan.ru/product/kreslo-vitio-velvet-yellow-new
Кресло Пайпел-2 Bucle Forest,40 990руб.,https://www.divan.ru/product/kreslo-pajpel-2-bucle-forest
Диван прямой Види Textile Navy Blue,25 990руб.,https://www.divan.ru/product/divan-vidi-textile-navy-blue
Кресло Ансил Bucle Milk,31 990руб.,https://www.divan.ru/product/kreslo-ansil-bucle-milk
Диван угловой Аронт Мини Velvet Olive,59 990руб.,https://www.divan.ru/product/divan-uglovoj-aront-mini-velvet-olive
Пуф Кропс Bucle Lilac,8990руб.,https://www.divan.ru/product/puf-krops-bucle-lilac
Пуф Кофи Velvet Light,4590руб.,https://www.divan.ru/product/puf-kofi-velvet-light
Кресло Тилар Textile Yellow,23 990руб.,https://www.divan.ru/product/kreslo-tilar-textile-yellow
Диван прямой Лави Velvet Moss,44 990руб.,https://www.divan.ru/product/divan-lavi-velvet-moss
Диван прямой Викс Textile Silver,24 990руб.,https://www.divan.ru/product/divan-viks-textile-silver
Кресло Лонди Cozy Ivory,43 990руб.,https://www.divan.ru/product/kreslo-londi-cozy-ivory
Диван прямой Лилле Velvet Atlantic,46 990руб.,https://www.divan.ru/product/divan-lille-velvet-atlantic
Пуф Дзен-1 Velvet Beige,9990руб.,https://www.divan.ru/product/puf-dzen-1-velvet-beige
Диван прямой Саннес Velvet Terra,44 990руб.,https://www.divan.ru/product/divan-sannes-velvet-terra
Диван прямой Роттердам Velvet Silver,27 990руб.,https://www.divan.ru/product/divan-rotterdam-velvet-silver
Диван прямой Сваут Velvet Beige,66 990руб.,https://www.divan.ru/product/divan-svaut-velvet-beige
Диван угловой Стаус Velvet Olive,42 990руб.,https://www.divan.ru/product/divan-uglovoj-staus-velvet-olive
Кресло Кальдера Barhat Mint,34 990руб.,https://www.divan.ru/product/kreslo-kaldera-barhat-mint
Диван прямой Терм Velvet Beige,69 990руб.,https://www.divan.ru/product/divan-term-velvet-beige
Кресло-кровать Кейсес Velvet Grey,22 990руб.,https://www.divan.ru/product/kreslo-krovat-kejses-velvet-grey
Кушетка Ринт Bucle Pink,21 990руб.,https://www.divan.ru/product/kushetka-rint-bucle-pink
Диван прямой Тайлин Velvet Yellow,39 990руб.,https://www.divan.ru/product/divan-tajlin-velvet-yellow
Кресло Элвит Cozy Ivory,29 990руб.,https://www.divan.ru/product/kreslo-elvit-cozy-ivory
Диван прямой Слипсон Velvet Silver,59 990руб.,https://www.divan.ru/product/divan-slipson-velvet-silver
Диван угловой Аллаум Linia Mint,54 990руб.,https://www.divan.ru/product/divan-uglovoj-allaum-linia-mint
Кресло Винси Textile Ginger,20 990руб.,https://www.divan.ru/product/kreslo-vinsi-textile-ginger
Диван прямой Рон Textile Grafit,54 990руб.,https://www.divan.ru/product/divan-ron-textile-grafit
Диван модульный Этен 1 Vertical Milk,115 950руб.,https://www.divan.ru/product/modulnyj-divan-eten-1-vertical-milk
Диван прямой Спейс Soft Navy Blue,66 990руб.,https://www.divan.ru/product/divan-spejs-soft-navy-blue
Пуф Акера-2 Velvet Yellow,11 990руб.,https://www.divan.ru/product/puf-akera-2-velvet-yellow
Диван прямой Эби Мини Linia Mint,58 990руб.,https://www.divan.ru/product/divan-abi-mini-linia-mint
Диван прямой Льери Barhat Blue,84 990руб.,https://www.divan.ru/product/divan-leri-barhat-blue
Диван угловой Маркфул Velvet Light,79 990руб.,https://www.divan.ru/product/divan-uglovoj-markful-velvet-light
Диван прямой Сваут Velvet Moss,66 990руб.,https://www.divan.ru/product/divan-svaut-velvet-moss
Диван прямой Льери Мини Velvet Light,59 990руб.,https://www.divan.ru/product/divan-leri-mini-velvet-light
Диван прямой Эби Velvet Blue,66 990руб.,https://www.divan.ru/product/divan-ebi-velvet-blue
Диван прямой Спейс-2 Velvet Beige,89 990руб.,https://www.divan.ru/product/divan-spejs-2-velvet-beige
Диван модульный Риббл-1 Bucle Lilac,78 980руб.,https://www.divan.ru/product/modulnyj-divan-ribbl-1-bucle-lilac
Кресло Кальдера Bucle Cloud,36 990руб.,https://www.divan.ru/product/kreslo-kaldera-bucle-cloud
Кресло Тилар Cozy Milk,23 990руб.,https://www.divan.ru/product/kreslo-tilar-cozy-milk
Диван угловой Дарол Velvet Silver,67 990руб.,https://www.divan.ru/product/divan-uglovoj-darol-velvet-silver
Диван прямой Дисент Velvet Beige,79 990руб.,https://www.divan.ru/product/divan-disent-velvet-beige
